{
"schema": "aurum.polyglot-toolchain-profile",
"version": 1,
"profile": "polyglot-toolchain-v1",
"lock": ".board/locks/oci/polyglot-toolchain-v1.lock.json",
"lock_digest": "sha256:8bcec766b995abd088e470f4756c8fc4de9e5f1ae797a014f9adda03c898092e",
"network": "none",
"user": "65534:65534",
"cap_drop": "ALL",
"cap_add": "none",
"mounts": "none",
"devices": "none",
"sockets": "none",
"pull": "never",
"tmpfs": "rw,nosuid,nodev",
"checkout_readonly": true,
"read_only_rootfs": true,
"no_new_privileges": true,
"privileged": false,
"timeout_seconds": 60,
"memory_mb": 256,
"cpu_millis": 1000,
"pids_limit": 128,
"tmpfs_mb": 128,
"stdout_limit_bytes": 65536,
"stderr_limit_bytes": 65536,
"max_input_files": 10000,
"max_input_bytes": 67108864,
"module_cache": "/go/pkg/mod",
"module_cache_read_only": true,
"polyglot_root": "/tmp/aurum-polyglot",
"toolchain_source": "digest-pinned",
"toolchain_materialization": "pre-materialized",
"toolchain_install": "denied",
"toolchain_bootstrap": "denied",
"package_install": "denied",
"package_registry": "denied",
"package_installs": 0,
"cache_mode": "read-only",
"telemetry": "denied",
"egress": "denied",
"host_toolchain": "denied",
"host_cache": "denied",
"host_filesystem": "denied",
"subprocess": "denied",
"unregistered_language": "denied",
"languages": ["bash", "c-cpp", "dotnet", "javascript", "powershell", "python", "rust", "typescript"],
"toolchains": {
"bash": {"runtime": "bash", "toolchain": "digest-pinned", "cache_root": "/tmp/aurum-polyglot/bash", "cache_mode": "read-only", "telemetry": "denied"},
"c-cpp": {"runtime": "cc", "toolchain": "digest-pinned", "cache_root": "/tmp/aurum-polyglot/c-cpp", "cache_mode": "read-only", "telemetry": "denied"},
"dotnet": {"runtime": "dotnet", "toolchain": "digest-pinned", "cache_root": "/tmp/aurum-polyglot/dotnet", "cache_mode": "read-only", "telemetry": "denied"},
"javascript": {"runtime": "node", "toolchain": "digest-pinned", "cache_root": "/tmp/aurum-polyglot/javascript", "cache_mode": "read-only", "telemetry": "denied"},
"powershell": {"runtime": "pwsh", "toolchain": "digest-pinned", "cache_root": "/tmp/aurum-polyglot/powershell", "cache_mode": "read-only", "telemetry": "denied"},
"python": {"runtime": "python3", "toolchain": "digest-pinned", "cache_root": "/tmp/aurum-polyglot/python", "cache_mode": "read-only", "telemetry": "denied"},
"rust": {"runtime": "cargo", "toolchain": "digest-pinned", "cache_root": "/tmp/aurum-polyglot/rust", "cache_mode": "read-only", "telemetry": "denied"},
"typescript": {"runtime": "tsc", "toolchain": "digest-pinned", "cache_root": "/tmp/aurum-polyglot/typescript", "cache_mode": "read-only", "telemetry": "denied"}
},
"max_languages": 8,
"max_packages": 4096,
"max_package_bytes": 16384,
"max_cache_bytes": 8388608,
"resolve_timeout_seconds": 5,
"environment": {"GOPROXY": "off", "GOSUMDB": "off", "GONOSUMDB": "*", "GOTOOLCHAIN": "local", "CGO_ENABLED": "0", "AURUM_POLYGLOT_ROOT": "/tmp/aurum-polyglot", "PIP_NO_INDEX": "1", "PIP_DISABLE_PIP_VERSION_CHECK": "1", "NPM_CONFIG_OFFLINE": "true", "NPM_CONFIG_REGISTRY": "", "NUGET_PACKAGES": "/tmp/aurum-polyglot/dotnet", "DOTNET_CLI_TELEMETRY_OPTOUT": "1", "DOTNET_NOLOGO": "1", "CARGO_HOME": "/tmp/aurum-polyglot/rust", "CARGO_NET_OFFLINE": "true", "POWERSHELL_TELEMETRY_OPTOUT": "1", "POWERSHELL_UPDATECHECK": "Off", "HTTP_PROXY": "", "HTTPS_PROXY": "", "NO_PROXY": "*"},
"command": ["go", "test", "-mod=readonly", "./..."]
}
